{
  "output_type": "design",
  "component_map": {
    "template_version": "1.0.0",
    "components": [
      {
        "component_name": "web",
        "required": true,
        "complexity": "complex",
        "complexity_rationale": "SSR storefront + admin; consumes all four service contracts; owns session/token handling and UX from S1.5.",
        "dependencies": [
          "auth.login",
          "auth.refresh",
          "checkout.confirm",
          "checkout.capture",
          "order.get",
          "order.transition",
          "inventory.adjust"
        ],
        "parallel_safe": false
      },
      {
        "component_name": "auth-service",
        "required": true,
        "complexity": "standard",
        "complexity_rationale": "Credentials + rotating refresh-token families; no upstream deps.",
        "dependencies": [],
        "parallel_safe": true
      },
      {
        "component_name": "inventory-service",
        "required": true,
        "complexity": "complex",
        "complexity_rationale": "Atomic reservation under the last-item race + TTL sweep; consumes payment/status events.",
        "dependencies": [
          "order.payment.captured",
          "order.status.changed"
        ],
        "parallel_safe": true
      },
      {
        "component_name": "checkout-service",
        "required": true,
        "complexity": "complex",
        "complexity_rationale": "Server-side totals, coupon, idempotent confirm, mock PSP; sync-orchestrates reserve+create (ADR-007/008).",
        "dependencies": [
          "inventory.reserve",
          "inventory.release",
          "order.create"
        ],
        "parallel_safe": false
      },
      {
        "component_name": "order-service",
        "required": true,
        "complexity": "standard",
        "complexity_rationale": "Immutable snapshots + forward-only fulfillment state machine; consumes payment events.",
        "dependencies": [
          "order.payment.captured"
        ],
        "parallel_safe": true
      }
    ]
  },
  "api_contracts": {
    "template_version": "1.0.0",
    "contracts": [
      {
        "contract_name": "auth.login",
        "payload_shape": {
          "request": {
            "email": "string",
            "password": "string"
          },
          "response": {
            "access_token": "string",
            "refresh_token": "string"
          }
        },
        "semantics": "sync",
        "idempotency_rules": "Not idempotent by design; rate-limited; each login issues a new session pair.",
        "failure_modes": [
          "invalid_credentials_generic",
          "rate_limited"
        ],
        "ordering_guarantees": "Synchronous request/response; no ordering concern.",
        "contract_version": "1.0.0"
      },
      {
        "contract_name": "auth.refresh",
        "payload_shape": {
          "request": {
            "refresh_token": "string"
          },
          "response": {
            "access_token": "string",
            "refresh_token": "string"
          }
        },
        "semantics": "sync",
        "idempotency_rules": "Single-use token keyed on refresh_token_id; concurrent refresh yields exactly one rotation, others fail closed.",
        "failure_modes": [
          "expired_token",
          "replayed_token_family_revoked",
          "invalid_token"
        ],
        "ordering_guarantees": "Synchronous; rotation is atomic.",
        "contract_version": "1.0.0"
      },
      {
        "contract_name": "inventory.reserve",
        "payload_shape": {
          "request": {
            "confirm_id": "string",
            "items": "array"
          },
          "response": {
            "reservation_id": "string",
            "ttl_seconds": 1800
          }
        },
        "semantics": "system_internal",
        "idempotency_rules": "Keyed on confirm_id; atomic conditional decrement; retry reserves once; already-reserved returns existing.",
        "failure_modes": [
          "insufficient_stock",
          "sku_not_found"
        ],
        "ordering_guarantees": "Synchronous; atomic decrement serializes the last-item race.",
        "contract_version": "1.0.0"
      },
      {
        "contract_name": "inventory.release",
        "payload_shape": {
          "request": {
            "reservation_id": "string",
            "reason": "string"
          }
        },
        "semantics": "system_internal",
        "idempotency_rules": "Keyed on reservation_id; release once; already-released is a no-op.",
        "failure_modes": [
          "reservation_not_found"
        ],
        "ordering_guarantees": "Synchronous or event-driven; compensating, commutative.",
        "contract_version": "1.0.0"
      },
      {
        "contract_name": "inventory.adjust",
        "payload_shape": {
          "request": {
            "sku": "string",
            "new_available": "int",
            "reason": "string"
          }
        },
        "semantics": "sync",
        "idempotency_rules": "Each adjustment is a distinct intentional entry; guarded by a current-state precondition (no below-reserved).",
        "failure_modes": [
          "below_reserved_rejected",
          "sku_not_found",
          "missing_reason"
        ],
        "ordering_guarantees": "Synchronous; precondition-guarded.",
        "contract_version": "1.0.0"
      },
      {
        "contract_name": "checkout.confirm",
        "payload_shape": {
          "request": {
            "cart_id": "string",
            "address": "string",
            "coupon": "string|null",
            "idempotency_key": "string"
          },
          "response": {
            "order_id": "string",
            "total": "int",
            "status": "awaiting-payment"
          }
        },
        "semantics": "sync",
        "idempotency_rules": "Client idempotency_key; duplicate confirm returns the same order; no second order/reservation; crash-safe via ADR-008.",
        "failure_modes": [
          "coupon_expired",
          "out_of_stock",
          "validation_error",
          "auth_required"
        ],
        "ordering_guarantees": "Synchronous; reserve precedes create.",
        "contract_version": "1.0.0"
      },
      {
        "contract_name": "checkout.capture",
        "payload_shape": {
          "request": {
            "order_id": "string",
            "provider_event_id": "string"
          },
          "response": {
            "outcome": "success|failure|timeout"
          }
        },
        "semantics": "sync",
        "idempotency_rules": "Dedupe on provider_event_id; duplicate provider callback applies once; captured amount must equal the server total.",
        "failure_modes": [
          "payment_declined",
          "payment_timeout",
          "amount_mismatch_rejected"
        ],
        "ordering_guarantees": "Synchronous trigger; provider callback deduped.",
        "contract_version": "1.0.0"
      },
      {
        "contract_name": "order.create",
        "payload_shape": {
          "request": {
            "confirm_id": "string",
            "snapshot": "object"
          },
          "response": {
            "order_id": "string"
          }
        },
        "semantics": "system_internal",
        "idempotency_rules": "Idempotent on confirm_id; duplicate returns the existing order; snapshots frozen at creation; safe to retry (ADR-008).",
        "failure_modes": [
          "invalid_payload"
        ],
        "ordering_guarantees": "Synchronous; called once per confirm.",
        "contract_version": "1.0.0"
      },
      {
        "contract_name": "order.get",
        "payload_shape": {
          "request": {
            "order_no": "string",
            "requester_id": "string"
          },
          "response": {
            "order": "object"
          }
        },
        "semantics": "sync",
        "idempotency_rules": "Read-only; naturally idempotent.",
        "failure_modes": [
          "not_owner_denied",
          "not_found"
        ],
        "ordering_guarantees": "Synchronous read; own-data-only authz.",
        "contract_version": "1.0.0"
      },
      {
        "contract_name": "order.transition",
        "payload_shape": {
          "request": {
            "order_no": "string",
            "target_state": "string",
            "tracking_no": "string|null"
          }
        },
        "semantics": "sync",
        "idempotency_rules": "Guarded by current-state precondition; re-submitting the same transition no-ops; forward-only.",
        "failure_modes": [
          "illegal_backward_rejected",
          "missing_tracking_on_shipped",
          "not_admin"
        ],
        "ordering_guarantees": "Synchronous; precondition serializes transitions.",
        "contract_version": "1.0.0"
      },
      {
        "contract_name": "order.payment.captured",
        "payload_shape": {
          "event": {
            "order_id": "string",
            "outcome": "string",
            "amount": "int",
            "audit_id": "string"
          }
        },
        "semantics": "async",
        "idempotency_rules": "Consumers dedupe on order_id+provider_event_id; effectively-once.",
        "failure_modes": [
          "consumer_lag",
          "dlq_on_poison_message"
        ],
        "ordering_guarantees": "Kafka partition key = audit_id (per-run FIFO); at-least-once + idempotent consumers; published via transactional outbox (ADR-008).",
        "contract_version": "1.0.0"
      },
      {
        "contract_name": "order.status.changed",
        "payload_shape": {
          "event": {
            "order_id": "string",
            "before": "string",
            "after": "string",
            "audit_id": "string"
          }
        },
        "semantics": "async",
        "idempotency_rules": "Consumers dedupe on order_id+after; effectively-once.",
        "failure_modes": [
          "consumer_lag",
          "dlq_on_poison_message"
        ],